{
  "kind": "review-record",
  "contractVersion": "1",
  "taskId": "review-m6-p7-20261001t003016z-337b73",
  "role": "clean-room-reviewer",
  "phase": "m6-p7",
  "head": "d8797642ac07ea89135a6abd96ba0b9ce3566850",
  "tier": "strongest",
  "requestedModel": "claude-opus-5",
  "executor": "claude-code",
  "vocabulary": {
    "id": "claude-code-model-vendors",
    "version": 1
  },
  "observation": {
    "model": "claude-opus-5",
    "topLevelModels": [
      "claude-opus-5"
    ],
    "subagentModels": [],
    "reason": "one model on the top-level rows of the captured stream"
  },
  "family": "anthropic",
  "verdict": {
    "path": "delivery/review/m6-p7-hazard-f.json",
    "sha256": "8e3b36083d9088f96025b0c75581d91bfae88367a0e5942ae89236fc0c7b87e2",
    "reason": "sha256 of the bytes the reviewer wrote, read after the executor exited"
  },
  "totalCostUsd": 1.6496119999999996,
  "usage": {
    "input_tokens": 70,
    "cache_creation_input_tokens": 49580,
    "cache_read_input_tokens": 1460574,
    "output_tokens": 16927,
    "output_tokens_details": {
      "thinking_tokens": 5598
    },
    "server_tool_use": {
      "web_search_requests": 0,
      "web_fetch_requests": 0
    },
    "service_tier": "standard",
    "cache_creation": {
      "ephemeral_1h_input_tokens": 49580,
      "ephemeral_5m_input_tokens": 0
    },
    "inference_geo": "not_available",
    "iterations": [
      {
        "input_tokens": 2,
        "output_tokens": 877,
        "cache_read_input_tokens": 59475,
        "cache_creation_input_tokens": 446,
        "cache_creation": {
          "ephemeral_5m_input_tokens": 0,
          "ephemeral_1h_input_tokens": 446
        },
        "type": "message"
      }
    ],
    "speed": "standard",
    "fallback_credit": null
  },
  "modelUsage": {
    "claude-opus-5": {
      "inputTokens": 70,
      "outputTokens": 16927,
      "cacheReadInputTokens": 1460574,
      "cacheCreationInputTokens": 49580,
      "webSearchRequests": 0,
      "costUSD": 1.6496119999999996,
      "contextWindow": 1000000,
      "maxOutputTokens": 64000,
      "thinkingTokens": 5598,
      "canonicalModel": "claude-opus-5",
      "provider": "firstParty",
      "costBasis": "list"
    }
  },
  "startedAt": "2026-10-01T00:30:18.057Z",
  "endedAt": "2026-10-01T00:41:20.169Z",
  "executorExitCode": 0
}
